PERSON_ID,NAME,DURATION,INTERACTION,COUNTERPART_ID,COUNTER_PART_NAME,TIME,MESSAGE,SENTIMENT_RESULT,P(POSITIVE),P(NEUTRAL),P(NEGATIVE)
PERSON_0000000001,Jennifer Martin,11.09906178,INTERACTION_0000000001,PERSON_0000000000,Matthew Chapman,02/01/22 18:33,Respond project nice Democrat along wife before accept travel human give subject.,positive,0.99,0,0
PERSON_0000000002,Nicholas Ochoa,108.8504049,INTERACTION_0000000000,PERSON_0000000002,Nicholas Ochoa,02/01/22 18:03,Put ask edge argue foreign bar staff attorney speech season art firm.,neutral,0.02,0.96,0.02
PERSON_0000000000,Matthew Chapman,3.735570654,INTERACTION_0000000001,PERSON_0000000000,Matthew Chapman,02/01/22 19:42,Growth down since seek start machine history watch development language difficult deal eye.,negative,0.01,0.02,0.97
PERSON_0000000001,Jennifer Martin,48.00786174,INTERACTION_0000000001,PERSON_0000000002,Nicholas Ochoa,02/01/22 19:20,Fund day respond international water specific property.,neutral,0.03,0.94,0.03
PERSON_0000000002,Nicholas Ochoa,49.40510055,INTERACTION_0000000000,PERSON_0000000002,Nicholas Ochoa,02/01/22 19:55,Over owner society treat over life town.,neutral,0.23,0.45,0.32
PERSON_0000000000,Matthew Chapman,34.72967218,INTERACTION_0000000001,PERSON_0000000002,Nicholas Ochoa,02/01/22 20:11,Word two learn bar campaign ever right if.,positive,0.74,0.22,0.04
PERSON_0000000001,Jennifer Martin,250.0789705,INTERACTION_0000000001,PERSON_0000000002,Nicholas Ochoa,02/01/22 20:09,Discussion he admit early stop perhaps bank argue finish personal experience early.,negative,0.01,0.09,0.9
PERSON_0000000002,Nicholas Ochoa,51.79019943,INTERACTION_0000000001,PERSON_0000000002,Nicholas Ochoa,02/01/22 20:57,Blood war fast safe certain respond century cut family hard quite range.,negative,0.04,0.02,0.94
PERSON_0000000000,Matthew Chapman,47.68596586,INTERACTION_0000000001,PERSON_0000000000,Matthew Chapman,02/01/22 21:00,Practice including really forget compare answer lawyer learn.,negative,0.02,0.03,0.96
PERSON_0000000001,Jennifer Martin,135.7323603,INTERACTION_0000000003,PERSON_0000000000,Matthew Chapman,02/01/22 21:47,Wait education water race your information result hand.,neutral,0.03,0.92,0.05
PERSON_0000000002,Nicholas Ochoa,92.23300012,INTERACTION_0000000001,PERSON_0000000002,Nicholas Ochoa,02/01/22 21:05,Tough start sometimes another each agreement main agent art mean.,negative,0.01,0.01,0.98
PERSON_0000000000,Matthew Chapman,13.06078574,INTERACTION_0000000001,PERSON_0000000000,Matthew Chapman,02/01/22 22:27,Drive arm consumer east build public fall defense note message.,neutral,0.02,0.79,0.19
PERSON_0000000001,Jennifer Martin,16.86855086,INTERACTION_0000000001,PERSON_0000000000,Matthew Chapman,02/01/22 22:13,Article again far every college guess sometimes reality trial wait on.,negative,0.08,0.15,0.77
PERSON_0000000002,Nicholas Ochoa,125.5439769,INTERACTION_0000000000,PERSON_0000000002,Nicholas Ochoa,02/01/22 22:13,Affect the report girl daughter across what political.,positive,0.61,0.08,0.31
PERSON_0000000000,Matthew Chapman,62.03929663,INTERACTION_0000000001,PERSON_0000000000,Matthew Chapman,02/01/22 23:22,Quality get left successful idea relationship measure once.,positive,0.99,0.01,0
PERSON_0000000001,Jennifer Martin,77.59878708,INTERACTION_0000000001,PERSON_0000000000,Matthew Chapman,02/01/22 23:30,Realize street system article beat send front.,neutral,0.02,0.95,0.02
PERSON_0000000002,Nicholas Ochoa,21.37204481,INTERACTION_0000000000,PERSON_0000000002,Nicholas Ochoa,02/01/22 23:05,Fast question surface water light bar election add western administration election would happy.,positive,0.93,0.06,0.01